number,value,datetime_start,datetime_complete,duration,params_metodo,params_n_elites,params_pc,params_pm,params_tamano_muestra,state
0,96.48394653284922,2026-05-13 21:31:57.700118,2026-05-13 21:32:01.103652,0 days 00:00:03.403534,windows,2,0.8065446188903402,0.00476292709507951,520,COMPLETE
1,347.31796443642094,2026-05-13 21:32:01.104535,2026-05-13 21:32:02.832542,0 days 00:00:01.728007,proportional,1,0.8250745333576128,0.001227334838507443,266,COMPLETE
2,146.518334795993,2026-05-13 21:32:02.833752,2026-05-13 21:32:08.353698,0 days 00:00:05.519946,proportional,4,0.8731023607926478,0.028414512498586172,921,COMPLETE
3,327.8029614772172,2026-05-13 21:32:08.357058,2026-05-13 21:32:11.328764,0 days 00:00:02.971706,proportional,2,0.6676052950500765,0.0012355325770535552,584,COMPLETE
4,5.459329194334831,2026-05-13 21:32:11.329584,2026-05-13 21:32:16.564199,0 days 00:00:05.234615,windows,3,0.9175043701468716,0.0025580372356810484,716,COMPLETE
5,50.632451950487614,2026-05-13 21:32:16.566301,2026-05-13 21:32:20.953371,0 days 00:00:04.387070,windows,5,0.793453113208572,0.0013888466273840854,673,COMPLETE
6,50.47706463645217,2026-05-13 21:32:20.954214,2026-05-13 21:32:25.469476,0 days 00:00:04.515262,proportional,4,0.825644957467006,0.003852239071489337,815,COMPLETE
7,6.265007389471991,2026-05-13 21:32:25.470222,2026-05-13 21:32:26.820075,0 days 00:00:01.349853,windows,1,0.777930733861023,0.017096869579891316,168,COMPLETE
8,193.2957179269528,2026-05-13 21:32:26.820742,2026-05-13 21:32:29.849035,0 days 00:00:03.028293,proportional,4,0.7121675210875297,0.01719082323431208,572,COMPLETE
9,632.8495888513874,2026-05-13 21:32:29.849847,2026-05-13 21:32:30.813690,0 days 00:00:00.963843,proportional,5,0.7434951869542077,0.008067209997023464,134,COMPLETE
10,216.19233267593214,2026-05-13 21:32:30.814552,2026-05-13 21:32:33.767655,0 days 00:00:02.953103,windows,3,0.9467403981463739,0.0029609165404542786,356,COMPLETE
11,34.70382472225021,2026-05-13 21:32:33.768611,2026-05-13 21:32:38.673632,0 days 00:00:04.905021,windows,1,0.6162155318209026,0.014762462784863475,764,COMPLETE
12,96.23907011001744,2026-05-13 21:32:38.675672,2026-05-13 21:32:41.800055,0 days 00:00:03.124383,windows,2,0.9457065010527896,0.04206029304782805,408,COMPLETE
13,294.44452877958776,2026-05-13 21:32:41.800990,2026-05-13 21:32:42.736184,0 days 00:00:00.935194,windows,3,0.8823549386272778,0.009043976965982258,119,COMPLETE
14,427.7575341063504,2026-05-13 21:32:42.737116,2026-05-13 21:32:49.107909,0 days 00:00:06.370793,windows,1,0.8848378186504725,0.00259053891823662,978,COMPLETE
15,93.11577819055924,2026-05-13 21:32:49.108715,2026-05-13 21:32:53.434870,0 days 00:00:04.326155,windows,2,0.7512066089763598,0.013678830040047994,730,COMPLETE
16,115.71121908368968,2026-05-13 21:32:53.435710,2026-05-13 21:32:56.056809,0 days 00:00:02.621099,windows,3,0.6798825198933096,0.0021284937906706834,451,COMPLETE
17,105.11655335152491,2026-05-13 21:32:56.057621,2026-05-13 21:32:57.970111,0 days 00:00:01.912490,windows,1,0.8526194300189072,0.005926666810718904,254,COMPLETE
18,29.12245491265478,2026-05-13 21:32:57.971151,2026-05-13 21:33:03.624333,0 days 00:00:05.653182,windows,4,0.91133195217253,0.02105491139973779,857,COMPLETE
19,87.50529256115279,2026-05-13 21:33:03.625015,2026-05-13 21:33:07.073806,0 days 00:00:03.448791,windows,2,0.6072339390206538,0.011057153533433343,650,COMPLETE
20,141.9128460931541,2026-05-13 21:33:07.074988,2026-05-13 21:33:09.013959,0 days 00:00:01.938971,windows,3,0.7746079316383262,0.04921194532879988,288,COMPLETE
21,13.035104975474365,2026-05-13 21:33:09.014750,2026-05-13 21:33:14.701752,0 days 00:00:05.687002,windows,4,0.9146487780045944,0.023330482338644567,818,COMPLETE
22,60.774268524646196,2026-05-13 21:33:14.702728,2026-05-13 21:33:20.852728,0 days 00:00:06.150000,windows,5,0.9164649820715247,0.02722249805282258,868,COMPLETE
23,22.007159260199778,2026-05-13 21:33:20.853615,2026-05-13 21:33:25.778933,0 days 00:00:04.925318,windows,4,0.910853977689868,0.032147095580928355,714,COMPLETE
24,9.69572161296145,2026-05-13 21:33:25.779734,2026-05-13 21:33:30.939453,0 days 00:00:05.159719,windows,4,0.8495805474899276,0.019633303513196577,807,COMPLETE
25,34.140834202267584,2026-05-13 21:33:30.940293,2026-05-13 21:33:35.052531,0 days 00:00:04.112238,windows,5,0.8191701283217045,0.0065206992465926695,636,COMPLETE
26,237.57383998496553,2026-05-13 21:33:35.053173,2026-05-13 21:33:38.844661,0 days 00:00:03.791488,windows,3,0.865562185087949,0.010508217041885705,512,COMPLETE
27,30.786130047008765,2026-05-13 21:33:38.846064,2026-05-13 21:33:40.383582,0 days 00:00:01.537518,windows,3,0.841970072490895,0.01865054469157567,192,COMPLETE
28,25.0488530003653,2026-05-13 21:33:40.384236,2026-05-13 21:33:45.657575,0 days 00:00:05.273339,windows,2,0.7752600258982245,0.03630102980864367,791,COMPLETE
29,99.2733971993573,2026-05-13 21:33:45.658263,2026-05-13 21:33:48.708121,0 days 00:00:03.049858,windows,4,0.8006521006695265,0.005020426711143666,480,COMPLETE
30,10.300352478056762,2026-05-13 21:33:48.708793,2026-05-13 21:33:53.872747,0 days 00:00:05.163954,windows,2,0.7313143570402189,0.001917775396012544,925,COMPLETE
31,78.7871434976475,2026-05-13 21:33:53.873628,2026-05-13 21:33:59.767247,0 days 00:00:05.893619,windows,2,0.7126917218419315,0.0018484286127673493,986,COMPLETE
32,39.74644117636994,2026-05-13 21:33:59.768276,2026-05-13 21:34:05.047751,0 days 00:00:05.279475,windows,1,0.7284027133343612,0.003869552147969166,910,COMPLETE
33,11.15328436562985,2026-05-13 21:34:05.048568,2026-05-13 21:34:10.316169,0 days 00:00:05.267601,windows,1,0.6767048643198555,0.0017156472661434725,942,COMPLETE
34,43.64466281566674,2026-05-13 21:34:10.316962,2026-05-13 21:34:14.568512,0 days 00:00:04.251550,proportional,2,0.7654188825468711,0.0010200186338294246,865,COMPLETE
35,153.12033969391953,2026-05-13 21:34:14.569388,2026-05-13 21:34:19.162245,0 days 00:00:04.592857,windows,3,0.8374231178162904,0.0030352895414994053,724,COMPLETE
36,47.41249793916284,2026-05-13 21:34:19.163124,2026-05-13 21:34:22.339607,0 days 00:00:03.176483,proportional,2,0.7976975175263277,0.004113041843412591,599,COMPLETE
37,9.50580795834529,2026-05-13 21:34:22.340675,2026-05-13 21:34:27.431655,0 days 00:00:05.090980,windows,1,0.6470459169992786,0.0016177352526624185,906,COMPLETE
38,68.70673398278987,2026-05-13 21:34:27.432585,2026-05-13 21:34:30.302338,0 days 00:00:02.869753,proportional,1,0.6224787101315953,0.0013703568377649634,696,COMPLETE
39,41.089099563950555,2026-05-13 21:34:30.303200,2026-05-13 21:34:34.874902,0 days 00:00:04.571702,windows,1,0.6452977142405938,0.0010299979066568808,766,COMPLETE
40,211.19091980398335,2026-05-13 21:34:34.875772,2026-05-13 21:34:38.150694,0 days 00:00:03.274922,proportional,5,0.817132546708284,0.014275619042470204,543,COMPLETE
41,65.08086956774713,2026-05-13 21:34:38.151361,2026-05-13 21:34:43.256811,0 days 00:00:05.105450,windows,1,0.6504765944338396,0.001625064218047087,914,COMPLETE
42,153.26337679114948,2026-05-13 21:34:43.257699,2026-05-13 21:34:48.123535,0 days 00:00:04.865836,windows,2,0.688544200128734,0.003017972441208651,823,COMPLETE
43,69.03016564129422,2026-05-13 21:34:48.124276,2026-05-13 21:34:53.736972,0 days 00:00:05.612696,windows,1,0.7130376104933551,0.002260185318839901,951,COMPLETE
44,58.13582034520016,2026-05-13 21:34:53.737742,2026-05-13 21:34:58.716604,0 days 00:00:04.978862,windows,2,0.6978997680812304,0.001461253312185032,900,COMPLETE
45,46.44686177846594,2026-05-13 21:34:58.717372,2026-05-13 21:35:04.521203,0 days 00:00:05.803831,windows,1,0.7378930251209945,0.0022035828898915436,998,COMPLETE
46,12.21974408448461,2026-05-13 21:35:04.521888,2026-05-13 21:35:10.006557,0 days 00:00:05.484669,windows,3,0.8960029531819309,0.0027012338727943714,841,COMPLETE
47,66.17678727292287,2026-05-13 21:35:10.007635,2026-05-13 21:35:14.466350,0 days 00:00:04.458715,windows,4,0.7572112788093682,0.008007669926863272,781,COMPLETE
48,247.03377747356572,2026-05-13 21:35:14.467063,2026-05-13 21:35:16.638225,0 days 00:00:02.171162,proportional,1,0.9382708510175092,0.0012494988557456258,365,COMPLETE
49,88.38790805987682,2026-05-13 21:35:16.638961,2026-05-13 21:35:22.095375,0 days 00:00:05.456414,windows,2,0.7843621371459147,0.004770703476629134,888,COMPLETE
